{
  "$schema": "https://json-schema.org/draft/2020-12/schema",
  "$id": "https://raw.githubusercontent.com/d-rothen/euler-dataset-contract/main/schemas/dataset-head-1.0.schema.json",
  "title": "Euler dataset head schema",
  "description": "Common cross-package dataset head contract.",
  "type": "object",
  "required": [
    "contract",
    "dataset",
    "modality"
  ],
  "properties": {
    "contract": {
      "type": "object",
      "required": [
        "kind",
        "version"
      ],
      "properties": {
        "kind": {
          "type": "string",
          "const": "dataset_head"
        },
        "version": {
          "type": "string",
          "pattern": "^\\d+\\.\\d+(?:\\.\\d+)?$",
          "default": "1.0"
        }
      },
      "additionalProperties": false
    },
    "dataset": {
      "type": "object",
      "required": [
        "id",
        "name"
      ],
      "properties": {
        "id": {
          "type": "string",
          "pattern": "^[A-Za-z_][A-Za-z0-9_]*$"
        },
        "name": {
          "type": "string",
          "minLength": 1,
          "pattern": "\\S"
        },
        "attributes": {
          "type": "object",
          "additionalProperties": true
        }
      },
      "additionalProperties": false
    },
    "modality": {
      "type": "object",
      "required": [
        "key"
      ],
      "properties": {
        "key": {
          "type": "string",
          "pattern": "^[A-Za-z_][A-Za-z0-9_]*$"
        },
        "meta": {
          "type": "object",
          "additionalProperties": true
        }
      },
      "additionalProperties": false
    },
    "addons": {
      "type": "object",
      "propertyNames": {
        "pattern": "^[A-Za-z_][A-Za-z0-9_]*$"
      },
      "additionalProperties": {
        "type": "object",
        "required": [
          "version"
        ],
        "properties": {
          "version": {
            "type": "string",
            "pattern": "^\\d+\\.\\d+(?:\\.\\d+)?$"
          }
        },
        "additionalProperties": true
      }
    }
  },
  "additionalProperties": false,
  "$defs": {
    "modalityMeta": {
      "depth": {
        "type": "object",
        "description": "Required meta fields when modality.key is 'depth'.",
        "properties": {
          "dimensions": {
            "type": "object",
            "propertyNames": {
              "pattern": "^[A-Za-z_][A-Za-z0-9_]*$"
            },
            "minProperties": 1,
            "additionalProperties": {
              "type": "integer",
              "minimum": 1
            },
            "examples": [
              {
                "height": 375,
                "width": 1242,
                "channels": 3
              },
              {
                "time": 16,
                "features": 512
              },
              {
                "x": 256,
                "y": 256,
                "z": 64
              }
            ],
            "x-ui": {
              "widget": "keyValueTable",
              "keyLabel": "Axis",
              "valueLabel": "Size",
              "allowCustomKeys": true,
              "suggestedKeys": [
                "height",
                "width",
                "channels",
                "depth",
                "time",
                "features"
              ]
            },
            "description": "Dataset-wide nominal sample dimensions keyed by semantic axis names (for example {'height': 375, 'width': 1242, 'channels': 3}). Omit this field when there is no single dataset-wide shape."
          },
          "file_types": {
            "type": "array",
            "items": {
              "type": "string",
              "pattern": "^[^./\\\\\\s][^/\\\\\\s]*$"
            },
            "minItems": 1,
            "uniqueItems": true,
            "examples": [
              [
                "png"
              ],
              [
                "jpg",
                "png"
              ],
              [
                "npy"
              ]
            ],
            "description": "Observed data file types for this modality, stored as lowercase extensions without leading dots (for example ['jpg', 'png'])."
          },
          "radial_depth": {
            "type": "boolean",
            "description": "Whether the depth values represent radial (euclidean) distance from the camera rather than perpendicular (z-buffer) depth.",
            "default": false
          },
          "range": {
            "type": "array",
            "items": {
              "type": "number"
            },
            "minItems": 2,
            "maxItems": 2,
            "description": "Value range of the depth values in meters (e.g. [0, 65535] for VKITTI2).",
            "default": [
              0,
              65535
            ]
          },
          "scale_to_meters": {
            "type": "number",
            "description": "Factor that converts raw depth values to meters (e.g. 0.001 when stored in millimetres).",
            "default": 1.0
          }
        },
        "required": [
          "radial_depth",
          "range",
          "scale_to_meters"
        ],
        "additionalProperties": true
      },
      "rgb": {
        "type": "object",
        "description": "Required meta fields when modality.key is 'rgb'.",
        "properties": {
          "dimensions": {
            "type": "object",
            "propertyNames": {
              "pattern": "^[A-Za-z_][A-Za-z0-9_]*$"
            },
            "minProperties": 1,
            "additionalProperties": {
              "type": "integer",
              "minimum": 1
            },
            "examples": [
              {
                "height": 375,
                "width": 1242,
                "channels": 3
              },
              {
                "time": 16,
                "features": 512
              },
              {
                "x": 256,
                "y": 256,
                "z": 64
              }
            ],
            "x-ui": {
              "widget": "keyValueTable",
              "keyLabel": "Axis",
              "valueLabel": "Size",
              "allowCustomKeys": true,
              "suggestedKeys": [
                "height",
                "width",
                "channels",
                "depth",
                "time",
                "features"
              ]
            },
            "description": "Dataset-wide nominal sample dimensions keyed by semantic axis names (for example {'height': 375, 'width': 1242, 'channels': 3}). Omit this field when there is no single dataset-wide shape."
          },
          "file_types": {
            "type": "array",
            "items": {
              "type": "string",
              "pattern": "^[^./\\\\\\s][^/\\\\\\s]*$"
            },
            "minItems": 1,
            "uniqueItems": true,
            "examples": [
              [
                "png"
              ],
              [
                "jpg",
                "png"
              ],
              [
                "npy"
              ]
            ],
            "description": "Observed data file types for this modality, stored as lowercase extensions without leading dots (for example ['jpg', 'png'])."
          },
          "range": {
            "type": "array",
            "items": {
              "type": "number"
            },
            "minItems": 2,
            "maxItems": 2,
            "description": "Value range of the colour channels (e.g. [0, 255] for 8-bit or [0, 1] for normalised data).",
            "default": [
              0,
              255
            ]
          }
        },
        "required": [
          "range"
        ],
        "additionalProperties": true
      },
      "segmentation": {
        "type": "object",
        "description": "Required meta fields when modality.key is 'segmentation'.",
        "properties": {
          "dimensions": {
            "type": "object",
            "propertyNames": {
              "pattern": "^[A-Za-z_][A-Za-z0-9_]*$"
            },
            "minProperties": 1,
            "additionalProperties": {
              "type": "integer",
              "minimum": 1
            },
            "examples": [
              {
                "height": 375,
                "width": 1242,
                "channels": 3
              },
              {
                "time": 16,
                "features": 512
              },
              {
                "x": 256,
                "y": 256,
                "z": 64
              }
            ],
            "x-ui": {
              "widget": "keyValueTable",
              "keyLabel": "Axis",
              "valueLabel": "Size",
              "allowCustomKeys": true,
              "suggestedKeys": [
                "height",
                "width",
                "channels",
                "depth",
                "time",
                "features"
              ]
            },
            "description": "Dataset-wide nominal sample dimensions keyed by semantic axis names (for example {'height': 375, 'width': 1242, 'channels': 3}). Omit this field when there is no single dataset-wide shape."
          },
          "file_types": {
            "type": "array",
            "items": {
              "type": "string",
              "pattern": "^[^./\\\\\\s][^/\\\\\\s]*$"
            },
            "minItems": 1,
            "uniqueItems": true,
            "examples": [
              [
                "png"
              ],
              [
                "jpg",
                "png"
              ],
              [
                "npy"
              ]
            ],
            "description": "Observed data file types for this modality, stored as lowercase extensions without leading dots (for example ['jpg', 'png'])."
          },
          "skyclass": {
            "type": "array",
            "items": {
              "type": "integer",
              "minimum": 0,
              "maximum": 255
            },
            "minItems": 3,
            "maxItems": 3,
            "description": "Sky label of the segmentation map as an RGB triple: the value of a sky pixel when the stored file is viewed as RGB. A colour-coded map uses the sky colour (e.g. [90, 200, 255]); a single-channel class map uses [v, v, v] for sky label v (e.g. [23, 23, 23] for Cityscapes label IDs, [10, 10, 10] for train IDs); a class ID stored in one channel of a colour file keeps the other channels' values (e.g. [29, 0, 0] for an ID in the red channel).",
            "default": [
              0,
              0,
              0
            ]
          }
        },
        "required": [
          "skyclass"
        ],
        "additionalProperties": true
      },
      "semantic_segmentation": {
        "type": "object",
        "description": "Required meta fields when modality.key is 'semantic_segmentation'.",
        "properties": {
          "dimensions": {
            "type": "object",
            "propertyNames": {
              "pattern": "^[A-Za-z_][A-Za-z0-9_]*$"
            },
            "minProperties": 1,
            "additionalProperties": {
              "type": "integer",
              "minimum": 1
            },
            "examples": [
              {
                "height": 375,
                "width": 1242,
                "channels": 3
              },
              {
                "time": 16,
                "features": 512
              },
              {
                "x": 256,
                "y": 256,
                "z": 64
              }
            ],
            "x-ui": {
              "widget": "keyValueTable",
              "keyLabel": "Axis",
              "valueLabel": "Size",
              "allowCustomKeys": true,
              "suggestedKeys": [
                "height",
                "width",
                "channels",
                "depth",
                "time",
                "features"
              ]
            },
            "description": "Dataset-wide nominal sample dimensions keyed by semantic axis names (for example {'height': 375, 'width': 1242, 'channels': 3}). Omit this field when there is no single dataset-wide shape."
          },
          "file_types": {
            "type": "array",
            "items": {
              "type": "string",
              "pattern": "^[^./\\\\\\s][^/\\\\\\s]*$"
            },
            "minItems": 1,
            "uniqueItems": true,
            "examples": [
              [
                "png"
              ],
              [
                "jpg",
                "png"
              ],
              [
                "npy"
              ]
            ],
            "description": "Observed data file types for this modality, stored as lowercase extensions without leading dots (for example ['jpg', 'png'])."
          },
          "skyclass": {
            "type": "array",
            "items": {
              "type": "integer",
              "minimum": 0,
              "maximum": 255
            },
            "minItems": 3,
            "maxItems": 3,
            "description": "Sky label of the segmentation map as an RGB triple: the value of a sky pixel when the stored file is viewed as RGB. A colour-coded map uses the sky colour (e.g. [90, 200, 255]); a single-channel class map uses [v, v, v] for sky label v (e.g. [23, 23, 23] for Cityscapes label IDs, [10, 10, 10] for train IDs); a class ID stored in one channel of a colour file keeps the other channels' values (e.g. [29, 0, 0] for an ID in the red channel).",
            "default": [
              0,
              0,
              0
            ]
          }
        },
        "required": [
          "skyclass"
        ],
        "additionalProperties": true
      }
    }
  },
  "allOf": [
    {
      "if": {
        "properties": {
          "modality": {
            "properties": {
              "key": {
                "const": "depth"
              }
            },
            "required": [
              "key"
            ]
          }
        },
        "required": [
          "modality"
        ]
      },
      "then": {
        "properties": {
          "modality": {
            "properties": {
              "meta": {
                "$ref": "#/$defs/modalityMeta/depth"
              }
            },
            "required": [
              "meta"
            ]
          }
        }
      }
    },
    {
      "if": {
        "properties": {
          "modality": {
            "properties": {
              "key": {
                "const": "rgb"
              }
            },
            "required": [
              "key"
            ]
          }
        },
        "required": [
          "modality"
        ]
      },
      "then": {
        "properties": {
          "modality": {
            "properties": {
              "meta": {
                "$ref": "#/$defs/modalityMeta/rgb"
              }
            },
            "required": [
              "meta"
            ]
          }
        }
      }
    },
    {
      "if": {
        "properties": {
          "modality": {
            "properties": {
              "key": {
                "const": "segmentation"
              }
            },
            "required": [
              "key"
            ]
          }
        },
        "required": [
          "modality"
        ]
      },
      "then": {
        "properties": {
          "modality": {
            "properties": {
              "meta": {
                "$ref": "#/$defs/modalityMeta/segmentation"
              }
            },
            "required": [
              "meta"
            ]
          }
        }
      }
    },
    {
      "if": {
        "properties": {
          "modality": {
            "properties": {
              "key": {
                "const": "semantic_segmentation"
              }
            },
            "required": [
              "key"
            ]
          }
        },
        "required": [
          "modality"
        ]
      },
      "then": {
        "properties": {
          "modality": {
            "properties": {
              "meta": {
                "$ref": "#/$defs/modalityMeta/semantic_segmentation"
              }
            },
            "required": [
              "meta"
            ]
          }
        }
      }
    }
  ]
}
