{
  "contract": {
    "kind": "dataset_head",
    "version": "1.0"
  },
  "dataset": {
    "id": "phase0_rgb",
    "name": "Phase 0 synthetic RGB",
    "attributes": {
      "synthetic": true
    }
  },
  "modality": {
    "key": "rgb",
    "meta": {
      "range": [
        0,
        255
      ],
      "dimensions": {
        "height": 4,
        "width": 8,
        "channels": 3
      }
    }
  },
  "addons": {
    "phase0_annotations": {
      "version": "1.0",
      "description": "Opaque preservation test only; no replay or materialization claim.",
      "nested": {
        "operations": [
          {
            "resize": [
              2,
              4
            ]
          },
          {
            "crop": [
              2,
              2
            ]
          }
        ]
      }
    }
  }
}
